<?xml version="1.0" encoding="UTF-8"?>

<segment xmlns:xsi="http://www.w3.org/2001/XMLSchema-instance"
         xsi:noNamespaceSchemaLocation="../xsd/fints3.0/segment.xsd">

    <segment_version version="2">
        <deg element_name="Segmentkopf"
             element_anzahl="1"
             element_status="M">
            <de element_name="Segmentname" element_format="an" element_laenge="..6" element_status="M"
                element_anzahl="1"/>
            <de element_name="Segmentnummer" element_format="num" element_laenge="..3" element_status="M"
                element_anzahl="1"/>
            <de element_name="Segmentversion" element_format="num" element_laenge="..2" element_status="M"
                element_anzahl="1"/>
        </deg>
        <de element_name="Betreff"
            element_format="an"
            element_laenge="..35"
            element_status="M"
            element_anzahl="1"/>

        <de element_name="Freitextmeldung"
            element_format="txt"
            element_laenge="..2048"
            element_status="M"
            element_anzahl="1"/>
    </segment_version>
</segment>
