<?xml version="1.0" encoding="UTF-8"?>

<segment xmlns:xsi="http://www.w3.org/2001/XMLSchema-instance"
         xsi:noNamespaceSchemaLocation="../xsd/fints3.0/segment.xsd">

    <segment_version version="1">
        <deg element_name="Segmentkopf"
             element_anzahl="1"
             element_status="M">
            <de element_name="Segmentname" element_format="an" element_laenge="..6" element_status="M"
                element_anzahl="1"/>
            <de element_name="Segmentnummer" element_format="num" element_laenge="..3" element_status="M"
                element_anzahl="1"/>
            <de element_name="Segmentversion" element_format="num" element_laenge="..2" element_status="M"
                element_anzahl="1"/>
        </deg>

        <deg element_name="UnterstÃ¼tzte Komprimierungsverfahren"
             element_status="M"
             element_anzahl="1..9">
            <de element_name="Komprimierungsfunktion" element_format="code" element_laenge="..3" element_status="M"
                element_anzahl="1" element_restriktionen="0,1,2,3,4,5,6,7,999"/>
            <de element_name="Komprimierungsversion" element_format="num" element_laenge="..3" element_status="M"
                element_anzahl="..9"/>
        </deg>
    </segment_version>
</segment>
