<?xml version="1.0" encoding="UTF-8"?>

<segment xmlns:xsi="http://www.w3.org/2001/XMLSchema-instance"
         xsi:noNamespaceSchemaLocation="../xsd/fints3.0/segment.xsd">

    <segment_version version="2">
        <deg element_name="Segmentkopf"
             element_anzahl="1"
             element_status="M">
            <de element_name="Segmentname" element_format="an" element_laenge="..6" element_status="M"
                element_anzahl="1"/>
            <de element_name="Segmentnummer" element_format="num" element_laenge="..3" element_status="M"
                element_anzahl="1"/>
            <de element_name="Segmentversion" element_format="num" element_laenge="..2" element_status="M"
                element_anzahl="1"/>
        </deg>

        <deg element_name="Kreditinstituteskennung" element_format="kik" element_status="M"
             element_anzahl="1"/>

        <de element_name="Kunden-ID"
            element_format="id"
            element_status="M"
            element_anzahl="1"/>

        <de element_name="Kundensystem-ID"
            element_format="id"
            element_status="M"
            element_anzahl="1"/>

        <de element_name="Kundensystem-Status"
            element_format="code"
            element_laenge="1"
            element_status="M"
            element_anzahl="1"
            element_restriktionen="0,1"/>

    </segment_version>
</segment>
