<?xml version="1.0" encoding="UTF-8"?>

<segment xmlns:xsi="http://www.w3.org/2001/XMLSchema-instance"
         xsi:noNamespaceSchemaLocation="../xsd/fints3.0/segment.xsd">

    <segment_version version="3">
        <deg element_name="Segmentkopf"
             element_anzahl="1"
             element_status="M">
            <de element_name="Segmentname" element_format="an" element_laenge="..6" element_status="M"
                element_anzahl="1"/>
            <de element_name="Segmentnummer" element_format="num" element_laenge="..3" element_status="M"
                element_anzahl="1"/>
            <de element_name="Segmentversion" element_format="num" element_laenge="..2" element_status="M"
                element_anzahl="1"/>
        </deg>
        <de element_name="Nachrichtengröße"
            element_format="dig"
            element_laenge="12"
            element_status="M"
            element_anzahl="1"/>

        <de element_name="HBCI-Version"
            element_format="num"
            element_laenge="..3"
            element_status="M"
            element_anzahl="1"/>

        <de element_name="Dialog-ID"
            element_format="id"
            element_status="M"
            element_anzahl="1"/>

        <de element_name="Nachrichtennummer"
            element_format="null"
            element_laenge="..4"
            element_status="M"
            element_anzahl="1"
            element_restriktionen=">0"/>
        <deg element_name="Bezugsnachricht"
             element_status="K"
             element_anzahl="1">
            <de element_name="Dialog-ID" element_format="id" element_laenge="0" element_status="M"
                element_anzahl="1"/>
            <de element_name="Nachrichtennummer" element_format="num" element_laenge="..4" element_status="M"
                element_anzahl="1"/>
        </deg>
    </segment_version>
</segment>
